{
  "id": "lifecycle_default",
  "type": "lifecycle",
  "description": "Default boot: a player and two wolves in the test scene.",
  "initialScene": "scene_test",
  "globalFlags": {
    "tutorial_done": false,
    "wolves_killed": 0
  },
  "spawns": [
    { "entity": "entity_player", "position": [0, 0, 0] },
    { "entity": "entity_wolf", "count": 2, "position": [10, 0, 5] },
    { "entity": "entity_chest", "position": [2, 0, -3] },
    { "entity": "entity_guard", "position": [6, 0, 6] },
    { "entity": "entity_rat", "count": 2, "position": [-4, 0, 2] },
    { "entity": "entity_patron", "position": [1, 0, 1] },
    { "entity": "entity_soldier", "count": 2, "position": [18, 0, 0] },
    { "entity": "entity_dummy", "position": [24, 0, 0] },
    { "entity": "entity_attack_node", "position": [22, 0, 3] },
    { "entity": "entity_attack_node", "position": [22, 0, -3] },
    { "entity": "entity_forager", "position": [-15, 0, 5] }
  ]
}
